{
  "schema_version": "1.0",
  "video_id": "bSnja3z7N9E",
  "language": "zh",
  "source_type": "ASR_WHISPER",
  "provider": "faster-whisper",
  "generated_at": "2026-08-24T06:07:10Z",
  "text": "做 交 易 就 等 于 创 业 最近 有 好 几 个 人 想 来 会 学 习 做 交 易 的 但是 都 被 我 劝 退 了 原因 只有 一个 他们 要 的是 百 分 之 百 的 确 定 性 成 功 这 刮 保 蟲 吗 但 真 实 的 情况 是 做 交 易 就 等 于 一次 创 业 谁 如果 告诉 你 创 业 的 成 功 率 是 百 分 之 百 那 他 不是 骗 子 就是 神 线 众 所 周 知 这个 世界 上 没有 神 线 但 即 便 如此 我 还是 希望 有 更 多 的人 能 够 把 交 易 当 做 是 人 生 中 的 第一 次 创 业 因为 他 不用 读 办 公 室 不用 发 工 资 不用 看 房 东 脸 色 不用 陪 客 户 喝 酒 不用 没 日 没 夜 的 跑 市 场 甚 至 不用 辞 职 这 就是 交 易 市 场 当 代 年 轻 人 最 低 成 本 的 创 业 试 链 厂 如果 说 传 统 行 业 的 创 业 是 开 重 型 卡 车 如果 创 业 失 败 了 车 毁 文 王 我们 做 交 易 就 像 骑 平 衡 车 如果 创 业 失 败 了 顶 多 擦 破 点 皮 但 他 同 样 能 锻 炼 你的 商 业 思 维 能 力 风 险 管 理 能 力 和 抗 打 击 能 力 我们 先 说 第一 个 为什么 说 做 交 易 可以 锻 炼 你的 商 业 思 维 能 力 办 公 室 牛 马 领 的是 确 定 型 公 司 创 业 者 老 板 赚 的是 认 知 差 价 而 交 易 市 场 就是 最 残 酷 的 认 知 竞 技 场 你看 着 骆 骆 刚 要 长 满 舱 做 多 结 果 被 政 策 调 控 打 脸 这 和 你 开 奶 茶 店 没 调 研 客 流 量 就 装 修 是 一个 量 级 的 学 费 但是 做 交 易 有 个 地方 可以 作 弊 那 就是 亏 10 万 比 创 业 亏 100 万 学 到 的 经 验 更 浓 俗 什么 意思 呢 因为 K 线 图 它 不会 像 房 东 那 样 半 夜 催 你 交 房 租 爆 仓 了 顶 多 关 电 脑 吃 碗 泡 面 不用 面 对 员 工 讨 厉 的 修 夺 我们 接 着 再 说 第二 个 为什么 说 做 交 易 可以 锻 炼 你的 风 险 管 理 能 力 创 业 者 最 怕 什么 精 心 研 发 的 产 品 上 市 当 天 遇 上 行 业 地 震 交 易 者 最 怕 什么 看 准 的 趋 势 被 半 夜 突 发 的 黑 天 额 逆 转 这 两 件 事 本 质 上 都是 对 不 确 定 性 的 终 极 考 试 请 记 住 这 条 创 业 或者 说 交 易 铁 律 追 求 100 % 确 定 性 的人 建 议 直接 买 彩 票 至 少 它的 开 讲 时间 是 固 定 的 而 真 正 的 高 手 都 在 和 概 率 共 舞 就 像 烧 烤 店 老 板 永 远 背 着 雨 伞 和 风 扇 晴 天 卖 烤 串 雨 天 买 关 东 煮 就 像 幺 儿 园 老 师 要 求 每 个 家 长 都 给 孩子 书 包 里 塞 两 条 裤 子 因为 尿 裤 子 几 乎 是 娃 娃 们 的 必 然 事 件 最 后 我们 再 来 说 第三 个 做 交 易 可以 锻 炼 你的 抗 打 击 能 力 什么 意思 呢 比如 你 开 了 一 家 奶 茶 店 最 后 算 下 来 你的 盈 亏 平 衡 点 是 一 天 至 少 要 卖 掉 100 倍 奶 茶 否 则 不 可能 扛 过 去 三 个 月 但是 当 你 真 正 开 门 营 业 时 你 会 发 现 日 销 50 倍 就 已经 是 你的 极 限 了 紧 接 着 就是 打 折 促 销 现 金 流 锻 炼 关 电 打 击 一 条 龙 但是 做 交 易 它 不 一 样 啊 只 要 你 严 格 控 制 好 仓 位 哪 怕 你的 胜 率 只有 40 % 也 就是 10 次 交 易 中 有 6 次 都是 亏 钱 的 每 次 就 算 亏 1000 块 钱 那 你 兜 里 还 剩 4 000 可是 你的 盈 亏 比 高 啊 每 次 只 赢 都是 1 比 3 的 盈 亏 比 那 就是 4 000 乘 以 3 等 于 12 就 算 减 掉 你 亏 送 的 6 000 那 不 还有 6 000 的 吗 总 体 还是 转 的 所以 这里 的 抗 打 击 能 力 就是 你的 仓 位 管 理 和 交 易 次 数 管 理 比如 我 给 到 你的 建 议 就是 可以 把 你的 本 金 分 成 10 份 当 个 品 种 不要 超 过 3 份 本 金 新 手 入 场 的时候 也 不要 挑 那 些 波 动 力 很 高 的 市 场 比如 币 圈 啊 美 股 啊 等等 反 而 外 汇 罗 尔 纲 这 种 日 军 波 动 在 1. 5 % 以 下 的 非常 适 合 新 手 小 白 还有 最 重要 的 就是 严 格 要 求 自己 每 天 看 板 不 超 过 3 次 这样 就 能 够 避 免 自己 情 绪 化 决 策 和 频 繁 交 易 这 就是 所 谓 的 抗 打 击 能 力 说 白 了 就是 要 能 在 交 易 市 场 中 活 的 久 但是 90 % 出 入 市 场 的 小 白 都 喜欢 过 分 的 追 求 胜 率 50 % 的 胜 率 不 满 足 还 要 再 足 球 60 % 70 % 甚 至 90 % 但是 你要 知道 传 统 参 与 行 业 的 新 店 存 活 率 只有 20 % A 股 散 户 三 年 存 活 率 也 只有 5 % 但是 你有 40 % 的 胜 率 已经 不 低 了 总 结 一下 抗 打 击 能 力 就是 两 句 话 第一 句 与 其 提 高 胜 率 不 如 提 高 盈 亏 比 第二 句 管 理 好 仓 位 要 在 排 桌 上 活 的 久 所以 20 25 年 开 年 与 其 焦 虑 35 岁 失 业 危 机 不 如 把 正 干 账 户 当 创 业 公 司 把 老 板 发 的 薪 水 当 做 你的 天 使 投 资 轮 把 自己 训 练 成 一 人 CE O 要 知道 成 功 是 可以 复 制 的 如果 交 易 这 件 事 你 创 业 成 功 了 说 不 定 将 来 你 做 任 何 行 业 的 创 业 都 会 有人 有 余 不要 觉得 现在 已经 晚 了 要 知道 巴 菲 特 57 岁 才 赚 到 人 生 99 % 的 财 富 你 目前 账 户 里 那 点 波 动 资 金 连 租 一个 月 的 门 面 房 租 都 算 不 上 从 今天 开始 每 天 拿 出 两 个 小 时 按 照 我在 屏 幕 上 帮 你 总 结 的 20 25 最 佳 创 业 计 划 表 赶 紧 行 动 起 来 吧 我是 善 意 把 复 杂 问题 讲 得 更 简 单 的 熊 猫 教 练 评 论 区 回 复 交 易 我在 后 台 偷 偷 的 告诉 你 哪 四 类 人 是 不 适 合 做 交 易 的 如果 您 还 没有 订 阅 我的 频 道 欢 迎 点 击 小 铃 铛 订 阅 同 时 也 感 谢 您 的 点 赞 评 论 转 发 您 的 支持 是我 持 续 输 出 的 最 大 动 力 更 多 干 货 可以 微 信 扫 描 屏 幕 上 方 二 维 码 关 注 公 众 号 我们 下 期 再见",
  "segments": [
    {
      "segment_id": "SEG_0001",
      "start": 0.0,
      "end": 44.42,
      "text": "做 交 易 就 等 于 创 业 最近 有 好 几 个 人 想 来 会 学 习 做 交 易 的 但是 都 被 我 劝 退 了 原因 只有 一个 他们 要 的是 百 分 之 百 的 确 定 性 成 功 这 刮 保 蟲 吗 但 真 实 的 情况 是 做 交 易 就 等 于 一次 创 业 谁 如果 告诉 你 创 业 的 成 功 率 是 百 分 之 百 那 他 不是 骗 子 就是 神 线 众 所 周 知 这个 世界 上 没有 神 线 但 即 便 如此 我 还是 希望 有 更 多 的人 能 够 把 交 易 当 做 是 人 生 中 的 第一 次 创 业 因为 他 不用 读 办 公 室 不用 发 工 资 不用 看 房 东 脸 色 不用 陪 客 户 喝 酒 不用 没 日 没 夜 的 跑 市 场 甚 至 不用 辞 职 这 就是 交 易 市 场 当 代 年 轻 人 最 低 成 本 的 创 业 试 链 厂"
    },
    {
      "segment_id": "SEG_0002",
      "start": 45.64,
      "end": 329.78,
      "text": "如果 说 传 统 行 业 的 创 业 是 开 重 型 卡 车 如果 创 业 失 败 了 车 毁 文 王 我们 做 交 易 就 像 骑 平 衡 车 如果 创 业 失 败 了 顶 多 擦 破 点 皮 但 他 同 样 能 锻 炼 你的 商 业 思 维 能 力 风 险 管 理 能 力 和 抗 打 击 能 力 我们 先 说 第一 个 为什么 说 做 交 易 可以 锻 炼 你的 商 业 思 维 能 力 办 公 室 牛 马 领 的是 确 定 型 公 司 创 业 者 老 板 赚 的是 认 知 差 价 而 交 易 市 场 就是 最 残 酷 的 认 知 竞 技 场 你看 着 骆 骆 刚 要 长 满 舱 做 多 结 果 被 政 策 调 控 打 脸 这 和 你 开 奶 茶 店 没 调 研 客 流 量 就 装 修 是 一个 量 级 的 学 费 但是 做 交 易 有 个 地方 可以 作 弊 那 就是 亏 10 万 比 创 业 亏 100 万 学 到 的 经 验 更 浓 俗 什么 意思 呢 因为 K 线 图 它 不会 像 房 东 那 样 半 夜 催 你 交 房 租 爆 仓 了 顶 多 关 电 脑 吃 碗 泡 面 不用 面 对 员 工 讨 厉 的 修 夺 我们 接 着 再 说 第二 个 为什么 说 做 交 易 可以 锻 炼 你的 风 险 管 理 能 力 创 业 者 最 怕 什么 精 心 研 发 的 产 品 上 市 当 天 遇 上 行 业 地 震 交 易 者 最 怕 什么 看 准 的 趋 势 被 半 夜 突 发 的 黑 天 额 逆 转 这 两 件 事 本 质 上 都是 对 不 确 定 性 的 终 极 考 试 请 记 住 这 条 创 业 或者 说 交 易 铁 律 追 求 100 % 确 定 性 的人 建 议 直接 买 彩 票 至 少 它的 开 讲 时间 是 固 定 的 而 真 正 的 高 手 都 在 和 概 率 共 舞 就 像 烧 烤 店 老 板 永 远 背 着 雨 伞 和 风 扇 晴 天 卖 烤 串 雨 天 买 关 东 煮 就 像 幺 儿 园 老 师 要 求 每 个 家 长 都 给 孩子 书 包 里 塞 两 条 裤 子 因为 尿 裤 子 几 乎 是 娃 娃 们 的 必 然 事 件 最 后 我们 再 来 说 第三 个 做 交 易 可以 锻 炼 你的 抗 打 击 能 力 什么 意思 呢 比如 你 开 了 一 家 奶 茶 店 最 后 算 下 来 你的 盈 亏 平 衡 点 是 一 天 至 少 要 卖 掉 100 倍 奶 茶 否 则 不 可能 扛 过 去 三 个 月 但是 当 你 真 正 开 门 营 业 时 你 会 发 现 日 销 50 倍 就 已经 是 你的 极 限 了 紧 接 着 就是 打 折 促 销 现 金 流 锻 炼 关 电 打 击 一 条 龙 但是 做 交 易 它 不 一 样 啊 只 要 你 严 格 控 制 好 仓 位 哪 怕 你的 胜 率 只有 40 % 也 就是 10 次 交 易 中 有 6 次 都是 亏 钱 的 每 次 就 算 亏 1000 块 钱 那 你 兜 里 还 剩 4 000 可是 你的 盈 亏 比 高 啊 每 次 只 赢 都是 1 比 3 的 盈 亏 比 那 就是 4 000 乘 以 3 等 于 12 就 算 减 掉 你 亏 送 的 6 000 那 不 还有 6 000 的 吗 总 体 还是 转 的 所以 这里 的 抗 打 击 能 力 就是 你的 仓 位 管 理 和 交 易 次 数 管 理 比如 我 给 到 你的 建 议 就是 可以 把 你的 本 金 分 成 10 份 当 个 品 种 不要 超 过 3 份 本 金 新 手 入 场 的时候 也 不要 挑 那 些 波 动 力 很 高 的 市 场 比如 币 圈 啊 美 股 啊 等等 反 而 外 汇 罗 尔 纲 这 种 日 军 波 动 在 1. 5 % 以 下 的 非常 适 合 新 手 小 白 还有 最 重要 的 就是 严 格 要 求 自己 每 天 看 板 不 超 过 3 次 这样 就 能 够 避 免 自己 情 绪 化 决 策 和 频 繁 交 易 这 就是 所 谓 的 抗 打 击 能 力 说 白 了 就是 要 能 在 交 易 市 场 中 活 的 久 但是 90 % 出 入 市 场 的 小 白 都 喜欢 过 分 的 追 求 胜 率 50 % 的 胜 率 不 满 足 还 要 再 足 球 60 % 70 % 甚 至 90 % 但是 你要 知道 传 统 参 与 行 业 的 新 店 存 活 率 只有 20 % A 股 散 户 三 年 存 活 率 也 只有 5 % 但是 你有 40 % 的 胜 率 已经 不 低 了 总 结 一下 抗 打 击 能 力 就是 两 句 话 第一 句 与 其 提 高 胜 率 不 如 提 高 盈 亏 比 第二 句 管 理 好 仓 位 要 在 排 桌 上 活 的 久 所以 20 25 年 开 年 与 其 焦 虑 35 岁 失 业 危 机 不 如 把 正 干 账 户 当 创 业 公 司 把 老 板 发 的 薪 水 当 做 你的 天 使 投 资 轮 把 自己 训 练 成 一 人 CE O 要 知道 成 功 是 可以 复 制 的 如果 交 易 这 件 事 你 创 业 成 功 了 说 不 定 将 来 你 做 任 何 行 业 的 创 业 都 会 有人 有 余 不要 觉得 现在 已经 晚 了 要 知道 巴 菲 特 57 岁 才 赚 到 人 生 99 % 的 财 富 你 目前 账 户 里 那 点 波 动 资 金 连 租 一个 月 的 门 面 房 租 都 算 不 上 从 今天 开始 每 天 拿 出 两 个 小 时 按 照 我在 屏 幕 上 帮 你 总 结 的 20 25 最 佳 创 业 计 划 表 赶 紧 行 动 起 来 吧 我是 善 意 把 复 杂 问题 讲 得 更 简 单 的 熊 猫 教 练 评 论 区 回 复 交 易 我在 后 台 偷 偷 的 告诉 你 哪 四 类 人 是 不 适 合 做 交 易 的 如果 您 还 没有 订 阅 我的 频 道 欢 迎 点 击 小 铃 铛 订 阅 同 时 也 感 谢 您 的 点 赞 评 论 转 发 您 的 支持 是我 持 续 输 出 的 最 大 动 力 更 多 干 货 可以 微 信 扫 描 屏 幕 上 方 二 维 码 关 注 公 众 号 我们 下 期 再见"
    }
  ],
  "words": [
    {
      "text": "做",
      "start": 0.0,
      "end": 0.26,
      "type": "word",
      "speaker_id": "speaker_0"
    },
    {
      "text": "交",
      "start": 0.26,
      "end": 0.44,
      "type": "word",
      "speaker_id": "speaker_0"
    },
    {
      "text": "易",
      "start": 0.44,
      "end": 0.66,
      "type": "word",
      "speaker_id": "speaker_0"
    },
    {
      "text": "就",
      "start": 0.66,
      "end": 0.94,
      "type": "word",
      "speaker_id": "speaker_0"
    },
    {
      "text": "等",
      "start": 0.94,
      "end": 1.12,
      "type": "word",
      "speaker_id": "speaker_0"
    },
    {
      "text": "于",
      "start": 1.12,
      "end": 1.3,
      "type": "word",
      "speaker_id": "speaker_0"
    },
    {
      "text": "创",
      "start": 1.3,
      "end": 1.5,
      "type": "word",
      "speaker_id": "speaker_0"
    },
    {
      "text": "业",
      "start": 1.5,
      "end": 1.78,
      "type": "word",
      "speaker_id": "speaker_0"
    },
    {
      "text": "最近",
      "start": 1.78,
      "end": 2.4,
      "type": "word",
      "speaker_id": "speaker_0"
    },
    {
      "text": "有",
      "start": 2.4,
      "end": 2.72,
      "type": "word",
      "speaker_id": "speaker_0"
    },
    {
      "text": "好",
      "start": 2.72,
      "end": 2.98,
      "type": "word",
      "speaker_id": "speaker_0"
    },
    {
      "text": "几",
      "start": 2.98,
      "end": 3.2,
      "type": "word",
      "speaker_id": "speaker_0"
    },
    {
      "text": "个",
      "start": 3.2,
      "end": 3.28,
      "type": "word",
      "speaker_id": "speaker_0"
    },
    {
      "text": "人",
      "start": 3.28,
      "end": 3.4,
      "type": "word",
      "speaker_id": "speaker_0"
    },
    {
      "text": "想",
      "start": 3.4,
      "end": 3.54,
      "type": "word",
      "speaker_id": "speaker_0"
    },
    {
      "text": "来",
      "start": 3.54,
      "end": 3.7,
      "type": "word",
      "speaker_id": "speaker_0"
    },
    {
      "text": "会",
      "start": 3.7,
      "end": 3.84,
      "type": "word",
      "speaker_id": "speaker_0"
    },
    {
      "text": "学",
      "start": 3.84,
      "end": 4.16,
      "type": "word",
      "speaker_id": "speaker_0"
    },
    {
      "text": "习",
      "start": 4.16,
      "end": 4.32,
      "type": "word",
      "speaker_id": "speaker_0"
    },
    {
      "text": "做",
      "start": 4.32,
      "end": 4.5,
      "type": "word",
      "speaker_id": "speaker_0"
    },
    {
      "text": "交",
      "start": 4.5,
      "end": 4.72,
      "type": "word",
      "speaker_id": "speaker_0"
    },
    {
      "text": "易",
      "start": 4.72,
      "end": 4.9,
      "type": "word",
      "speaker_id": "speaker_0"
    },
    {
      "text": "的",
      "start": 4.9,
      "end": 5.02,
      "type": "word",
      "speaker_id": "speaker_0"
    },
    {
      "text": "但是",
      "start": 5.02,
      "end": 5.34,
      "type": "word",
      "speaker_id": "speaker_0"
    },
    {
      "text": "都",
      "start": 5.34,
      "end": 5.58,
      "type": "word",
      "speaker_id": "speaker_0"
    },
    {
      "text": "被",
      "start": 5.58,
      "end": 5.8,
      "type": "word",
      "speaker_id": "speaker_0"
    },
    {
      "text": "我",
      "start": 5.8,
      "end": 5.96,
      "type": "word",
      "speaker_id": "speaker_0"
    },
    {
      "text": "劝",
      "start": 5.96,
      "end": 6.14,